{
  "$schema": "https://json-schema.org/draft/2020-12/schema",
  "$id": "https://plugagente.dev/schemas/rpc.response.v1.json",
  "title": "RPC Response",
  "description": "JSON-RPC 2.0 response emitted inside rpc:response PayloadFrame messages. When enableSocketApiVersionMeta is active, the agent includes api_version and meta automatically.",
  "type": "object",
  "required": ["jsonrpc", "id"],
  "properties": {
    "jsonrpc": { "const": "2.0" },
    "id": {},
    "result": {
      "type": "object",
      "properties": {
        "execution_id": { "type": ["string", "null"] },
        "stream_id": { "type": "string" },
        "started_at": { "type": "string", "format": "date-time" },
        "finished_at": { "type": "string", "format": "date-time" },
        "sql_handling_mode": {
          "type": "string",
          "enum": ["managed", "preserve"]
        },
        "max_rows_handling": {
          "type": "string",
          "enum": ["response_truncation"]
        },
        "effective_max_rows": {
          "type": "integer",
          "minimum": 1,
          "description": "Negotiated row cap effectively applied to the response."
        },
        "rows": {
          "type": "array",
          "items": {
            "type": "object",
            "additionalProperties": true
          }
        },
        "row_count": { "type": "integer", "minimum": 0 },
        "returned_rows": { "type": "integer", "minimum": 0 },
        "affected_rows": { "type": "integer", "minimum": 0 },
        "truncated": { "type": "boolean" },
        "column_metadata": {
          "type": "array",
          "items": {
            "type": "object",
            "additionalProperties": true
          }
        },
        "pagination": {
          "type": "object",
          "required": [
            "page",
            "page_size",
            "returned_rows",
            "has_next_page",
            "has_previous_page"
          ],
          "properties": {
            "page": { "type": "integer", "minimum": 1 },
            "page_size": { "type": "integer", "minimum": 1 },
            "returned_rows": { "type": "integer", "minimum": 0 },
            "has_next_page": { "type": "boolean" },
            "has_previous_page": { "type": "boolean" },
            "current_cursor": { "type": "string" },
            "next_cursor": { "type": "string" }
          },
          "additionalProperties": false
        }
      },
      "allOf": [
        {
          "if": {
            "required": ["execution_id"],
            "properties": { "execution_id": { "type": "null" } }
          },
          "then": {
            "required": ["found", "reason"],
            "properties": {
              "found": { "const": false },
              "reason": { "const": "not_found_in_retention_window" }
            }
          }
        }
      ],
      "additionalProperties": true
    },
    "error": { "$ref": "./rpc.error.schema.json" },
    "api_version": {
      "type": "string",
      "description": "Agent-selected Plug profile version returned when api/meta support is enabled."
    },
    "meta": {
      "type": "object",
      "description": "Protocol metadata returned by the agent. Only the published fields below are part of the response contract.",
      "properties": {
        "trace_id": { "type": "string" },
        "traceparent": { "type": "string" },
        "tracestate": { "type": "string" },
        "request_id": { "type": "string" },
        "agent_id": { "type": "string" },
        "timestamp": { "type": "string", "format": "date-time" },
        "agent_phases": {
          "type": "object",
          "additionalProperties": { "type": "number", "minimum": 0 }
        },
        "health_snapshot": {
          "type": "object",
          "additionalProperties": true
        }
      },
      "additionalProperties": false
    }
  },
  "oneOf": [
    { "required": ["result"], "not": { "required": ["error"] } },
    { "required": ["error"], "not": { "required": ["result"] } }
  ]
}
